{
  "$schema": "https://json-schema.org/draft/2020-12/schema",
  "title": "Specification processing-state record",
  "type": "object",
  "additionalProperties": false,
  "required": [
    "schemaVersion",
    "mode",
    "selectedWorkstreamId",
    "workstreams"
  ],
  "properties": {
    "schemaVersion": {
      "const": 1
    },
    "mode": {
      "const": "SINGLE"
    },
    "selectedWorkstreamId": {
      "type": "string",
      "pattern": "^[a-z][a-z0-9-]{1,63}$"
    },
    "workstreams": {
      "type": "array",
      "minItems": 1,
      "maxItems": 32,
      "items": {
        "type": "object",
        "additionalProperties": false,
        "required": [
          "id",
          "specPath",
          "stageId",
          "phase",
          "runId",
          "developerDecision"
        ],
        "properties": {
          "id": {
            "type": "string",
            "pattern": "^[a-z][a-z0-9-]{1,63}$"
          },
          "specPath": {
            "type": "string",
            "pattern": "^docs/specs/active/subspecs/[a-z0-9][a-z0-9-]*\\.md$"
          },
          "stageId": {
            "type": "string",
            "pattern": "^[A-Z][A-Za-z0-9.]*$"
          },
          "phase": {
            "enum": [
              "DESIGN",
              "READY_TO_DELEGATE",
              "RUNNING",
              "READY_FOR_REVIEW",
              "BLOCKED",
              "PAUSED",
              "AWAITING_DEVELOPER_DECISION",
              "ACCEPTED"
            ]
          },
          "runId": {
            "oneOf": [
              {
                "type": "null"
              },
              {
                "type": "string",
                "pattern": "^[a-zA-Z0-9][a-zA-Z0-9_-]{1,127}$"
              }
            ]
          },
          "developerDecision": {
            "enum": [
              "UNRECORDED",
              "ACCEPTED",
              "REJECTED"
            ]
          }
        }
      }
    }
  }
}
